speaker,line
AN AREA CLEANING WILL COMMENCE ON,"MONDAY FEBRUARY 8, 2016"
AT 5,"00 A.M. Suddenly the notice is doused in water from a high pressure hose and washed off the graffiti-covered wall. The hose is held by a man dressed in yellow waterproofs, who is slowly walking down the sidewalk and spraying water on the many homeless people who are sleeping and taking refuge against the building. Their belongings are caught in the spray, their bags and carts pulled away by the cleanup crew. A man in his mid-40s, JOSEPH CUTLER, is following the water jet, berating the homeless people for not having moved on already."
CUTLER,You people were told this was coming. This is the first phase in a relocation project that will see you transferred to the old Franklin Hospital in Bucks County! An officious-looking man drinking soup and a police officer in riot gear are watching the operation unfold in the background.
CUTLER,Any personal items collected tonight by the US Department of Housing and Urban Development can be retrieved... at our field office at 1804 South Walnut Street. His assistant is standing behind him. CUTLER surveys the operation before turning to his assistant.
CUTLER,Which is where I'll be. He takes a final look before heading to his car.
CUTLER,"Hey, give me a ride back to the field office. They leave. The officious-looking man, still watching, takes another good slurp of soup."
CUTLER,Your street is next! Tomorrow morning! You've been warned! YOU ARE RESPONSIBLE!
AN AREA CLEANING WILL COMMENCE ON,"TUESDAY FEBRUARY 9, 2016"
AT 5,00 A.M.
HOMELESS PERSON,"Hey! Hey, come on! Later. The street is deserted. A large refuse truck pulls up outside the building. It stops for several seconds, its engine idling, before driving off. We see a lone figure, dressed in a long dark trench coat, standing in the road behind where the truck came to a halt. The figure turns towards the building, before walking over to the entrance, his lumbering footsteps ringing out into the night. Inside the building. CUTLER is in his office. He squirts some antibacterial gel onto his hands from a dispenser on his desk. He picks up his cell phone and makes a call."
CUTLER,"Landry. Cutler. You still down there? Everything okay? Any problems? His sniffs. Suddenly he snorts heavily, losing his breath. He coughs."
CUTLER,"Oh. He hangs up the phone. The lights suddenly fizzle out, plunging the room into darkness. More lumbering footsteps. Metallic thuds sounding like pipes being struck with a hammer."
CUTLER,"Somebody out there? Through the frosted glass of his office door we see a large silhouetted figure approach the office. It stops in front of the door. CUTLER, starting to panic, dials 911 and pulls open his desk draw, reaching for his gun."
CUTLER,"This is Joseph Cutler. I'm at 1809 South Walnut. There's an intruder. He holds out his gun, aiming it on the figure standing the other side of his office door."
911 OPERATOR,"Sir, we're notifying the police. Are you in danger? CUTLER holds the phone to his ear but says nothing, too petrified to talk. The silhouetted figure gets larger as it steps towards the door."
911 OPERATOR,"Hello? Sir, tell us what's happening. Hello? The office door suddenly explodes into the room. Shards of glass fly through the air. The huge, barefoot figure walks over the floor strewn with broken glass towards CUTLER, who tries to draw his gun, but it is too late. The hulking figure grabs CUTLER and dismembers him using just his hands. The figure stands motionless, his arms outstretched, holding CUTLER's freshly-severed arms by the wrists."
911 OPERATOR,"Sir, are you there? A short time later. The figure leaves the building through a side exit, carrying CUTLER's arms. The refuse truck is waiting for him at the kerbside. He loads the remains into the back of the truck, before climbing in and lying down in the trash. The compactor lowers and closes over the two bodies, and the truck drives off, into the deserted street. THE TRUTH IS OUT THERE"
SCULLY,"I'm Special Agent Dana Scully, and this is Special Agent Fox Mulder. The FORENSIC TECH looks at the badges before calling out to his superior, DETECTIVE DROSS."
FORENSIC TECH,Detective?
DROSS,"How you doing? I'm Aaron Dross. I called the Bureau. They said that you two have experience with these, um... spooky cases. MULDER pouts."
DROSS,"Well, I don't want to be confrontational here, but, uh..."
MULDER,"It wouldn't be Philadelphia without a certain degree of confrontation, right?"
DROSS,"Look, all I'm saying is just because I called for a hand doesn't mean I'm looking to pass off this investigation to you. MULDER kneels down. We see a very large bloodstain in the middle of the office floor."
SCULLY,"I'm sure I don't have to point out to you, Detective, that the FBI has jurisdiction over the murder of a federal employee."
MULDER,Have you tried polyvinyl siloxane to try to lift the print?
FORENSIC TECH,"It's not that I can't lift a print, it's just... there's no prints to lift. A footprint is here, but there are no ridges. MULDER and SCULLY are now both kneeling down, inspecting the print."
MULDER,"Well, it looks like this person was born without footprints. Which is impossible... by the way."
SCULLY,Where was the victim found?
DROSS,"He's still here. With no obvious body, SCULLY looks perturbed by this. She stands up. DROSS moves towards CUTLER'S desk."
DROSS,He's there. He points to a bloody torso lying behind the desk.
DROSS,"And, uh, his head... is in a trash can here. DROSS motions down to the waste basket next to his feet."
MULDER,Not even in the proper recycling bin.
DROSS,"Both arms are gone, too. Must have been a sword or machete."
SCULLY,"The supraspinatus and the deltoideus appear to be shredded from the torso, not severed, as do the other points of separation."
DROSS,"So what are you telling me, that he was pulled apart?"
SCULLY,"Well, I don't think that would be possible for a... for a single human being. MULDER looks out of the office window. On a large, blank billboard atop a low rise building nearby we see a large, full-length mural of a man wearing a knee-length trench coat, his arms hanging by his side. The black-painted mural is almost 2 storeys high."
DROSS,"You know, the homeless out there, they hate this guy, this Cutler. See him as a reason for them having to relocate out to the old Franklin Hospital. SCULLY's cell phone starts to vibrate. She takes it out of her pocket. The caller display shows ""William"". It rings off, then rings again. The caller display shows ""William Scully Jr.""."
MULDER,"When a medieval prisoner was drawn and quartered, it took four horses charging off in four directions at full speed to tear him apart. SCULLY's phone rings again. She can't not answer it now."
SCULLY,"Bill, I'm at a crime scene. Is everything okay? Are you still in Germany? SCULLY stands up slowly, distraught."
SCULLY,Okay. Okay.
MULDER,Scully?
SCULLY,"That was, uh... that was my brother. He just... The EMTs found his phone number. Uh, my mom's just had a heart attack. She's in ICU in DC. SCULLY is in shock. MULDER steps over towards her, putting his hands on her arm for comfort."
MULDER,You go. Go.
SCULLY,Yeah. He watches SCULLY leave the office. She grabs the door frame as she rounds the door for support. As he looks up over the door MULDER notices the security camera in the office has been deliberately turned away from its intended viewpoint.
MULDER,"Here are the four mounted security cameras. There's the first one knocked out of position. Then the second one. And the third. And I saw that Cutler's was knocked out. But Cutler's eye-line is trained above the door, about Tim Duncan height. We can eliminate any 76ers, 'cause those guys can't find the rim. MULDER goes back to the footage. He notices something."
MULDER,"Oh. Look at that. The billboard outside Cutler's office. At the time of the murder, there's no artwork on it or graffiti. MULDER shows DROSS the black figure painted on the billboard opposite."
MULDER,That street art was put up this morning. After Cutler's murder. Maybe the artist that put it up there is saying something or saw something. I'm gonna see if it's signed or if anybody knows who made it.
DROSS,"Yeah. They leave the office. As they pass a small drinks station in the hallway MULDER stops as he hears something squish underfoot. He lifts his leg, turns his ankle to reveal the bottom of his shoe, and notices a small Band-Aid stuck to the sole of his shoe. Using a paper napkin he carefully peels it off. It's very sticky and bloodstained. He straightens up to better look at the Band-Aid. The smell is noxious. He grabs a few more paper napkins to preserve it as evidence and heads out after DROSS."
SCULLY,"Mom. A nurse, NURSE TAILLIE, walks over to the bed."
NURSE TAILLIE,Are you related to Margaret?
SCULLY,"Yes, I'm her daughter. I'm Dana Scully."
NURSE TAILLIE,She regained consciousness for a few moments. She repeatedly asked for someone named Charlie?
SCULLY,"Charlie's... my brother, her youngest son. They were estranged."
NURSE TAILLIE,"Oh, I thought you'd want to know."
SCULLY,"She didn't ask for me, or, or Bill? Or her grandchildren?"
NURSE TAILLIE,"Just Charlie. NURSE TAILLIE walks away, leaving SCULLY and MARGARET together in the empty ward. SCULLY leans in, caressing her mother's cheek with the back of her hand."
SCULLY,"Hi, Mom. It's me, Dana. I'm here. I've been where you are. I know that Ahab is there. And Melissa. But, Mom, I'm here. Bill Jr.'s here. And William. William's here. And Charlie... is here. Please, Mom, don't go home yet. I need you. Fade to black."
MULDER,"Hey, Officer?"
POLICE OFFICER,Mm-hmm. MULDER points up at the mural on the billboard behind the building.
MULDER,I'm gonna need access to the roof of that building.
POLICE OFFICER,"Yes, sir."
MULDER,"All right? The POLICE OFFICER heads off to sort out access. Whilst he stands looking up at the mural, MULDER overhears raised voices - one male, one female - on the street around the corner from the building."
WOMAN,"Landry, I'm not finished with you!"
MAN,"Look, look, this street gets cleaned out tomorrow morning."
WOMAN,Not after I get an injunction. This street is a crime scene.
MAN,Are you blaming these poor people for Joseph's murder?
WOMAN,Doesn't his murder convince you how much these people hate what you're doing to them?
MAN,Are you threatening me?
WOMAN,I've been threatening you for six months.
MAN,"Well, stop. MULDER approaches, holding his ID out in front of him."
MULDER,Special Agent Mulder with the FBI. And who are these two fine representatives of the City of Brotherly Love?
WOMAN,Hmm. We see the male is the soup eater from earlier.
LANDRY,Daryl Landry. I've been working with Joseph Cutler. We've been redeveloping this area.
MULDER,Mm-hmm. And you are? And why do you think someone down here killed him?
HUFF,Nancy Huff. I'm the president of the Central Bucks County school board. And this... douchebag and Cutler are moving...
MULDER,"Oh, you guys married? No?"
HUFF,To him? No.
MULDER,"Oh. ""Douchebag."" I thought maybe..."
HUFF,"Yeah, him and Cutler are moving these poor homeless out of this area in order to build a ten-story apartment building to kick-start gentrification."
LANDRY,"The old Franklin State Hospital is in her district, just sitting there empty. We're taking these poor people out of the downtown to that facility, away from the drug bazaar, the rats, the urine in the streets."
HUFF,I want these people to be safe and comfortable as much as anyone. I come down here every Thanksgiving and serve turkey dinners.
MULDER,Oh. But?
HUFF,"But the Franklin Hospital is just two blocks from Pennsbury High School. If one of these... downtown people killed Cutler, would you want that person moved near your children?"
MULDER,"Okay, okay, okay. Turning to HUFF"
MULDER,"I hear you speaking for them, but really you're speaking for yourself. Turning to LANDRY"
MULDER,"And I hear you speaking for them, but really speaking for yourself. What I don't hear is who speaks for them. A voice interrupts their conversation and provides the answer. Leaning against a large commercial trash bin in dirty clothes is a dreadlocked man. He points up towards the billboard."
HOMELESS MAN,"The Band-Aid Nose Man. They all turn towards him. MULDER walks over, his interest piqued."
MULDER,"Band-Aid Nose Man? What is that? That's... the name of the artist? Who is that? You know where I can find him? The HOMELESS MAN skulks off. MULDER looks up at the billboard. It is blank. The black figure has gone, along with the plywood sheeting it was painted on."
MULDER,"I don't know if my being here will help bring you back... but I'm here. Back to the present day. SCULLY notices an envelope on the bedside table containing her mother's personal effects. We note her patient ID number is 171927. She picks up the envelope and empties its contents into her hand. Two gold rings and a silver quarter on a necklace. She examines the necklace more closely, holding the coin in the light to read its engravings. Her cell phone buzzes. Caller ID says William Scully, Jr."
SCULLY,"Hey, Bill. What time is it where you are? What time is your flight from Frankfurt? Nearby, a cardiac monitor flatlines. A nurse, followed by porters, prepare to dress and remove the deceased body from the ward. They work fast. SCULLY is all too aware of their speed."
SCULLY,"Oh. I think you should get here as soon as you can. Oh, I can't... How am I to know that? I-I won't answer as to whether she's going to die before you get here. Bill, yes, I'm a doctor, but I'm also her daughter. Well, we'll keep her on life support. That's... that's what she wanted. Yes. Mom and I talked about it after my experience in a coma. She said that she wanted us to do everything that we could to keep her alive. Her advance directive is on the Living Will Registry. Yes. The porters wheel the recently-deceased patient out of the ward, passing directly in front of where SCULLY is sitting. She watches forlornly and sighs heavily, the closeness of death ever-apparent."
MULDER,Clean?
BUDD,So clean. There's nothing here.
MULDER,You can confirm that there's no presence of any pathogenic agents?
BUDD,"No, Mulder. I mean, there's nothing. Something's there. Some material appears apparent, but it's also not there. I used backscattered electron imaging to separate and identify inorganic particles from organic materials, and I found neither. There's no organic material on this Band-Aid, but there's no inorganic material either. It's not alive. It's not dead. MULDER fixates on the Band-Aid, intrigued."
SCULLY,Nurse? Is it wise to administer a hypertonic saline to a cardiac arrest patient?
NURSE TAILLIE,"Agent Scully, we had to confirm your mother's advance directive, and it indicates that she not be resuscitated if unconscious or requires artificial respiration. She amended it last year. It's signed and witnessed by two retired naval officers. SCULLY looks shocked. She turns to look at her mother. Suddenly MARGARET SCULLY's breathing becomes more laboured. Her eyelids flutter."
FITZPATRICK,Let's see what we got here.
PROUDLEY,Whew!
FITZPATRICK,This one's so big.
PROUDLEY,Yeah.
FITZPATRICK,This is new territory. It's not like him. We should go to Sotheby's on this.
PROUDLEY,Never knew you could make so much money off the homeless. PROUDLEY laughs at their apparent good fortune.
FITZPATRICK,I'll call our usual collectors. Put that away.
PROUDLEY,Okay. I got it. PROUDLEY slowly pushes the trolley further into the warehouse space. We lots lots of items covered in protective sheets and cloths. Professional photographic equipment for taking high quality images.
PROUDLEY,"Let's go, buddy. All right. He parks up the trolley and walks back. He starts to dial a number on his cell phone. The trolley suddenly rocks forwards and backwards before coming to a rest. PROUDLEY stops in his tracks. A fly buzzes. PROUDLEY turns back towards the artwork. The black figure on the artwork has disappeared. Confused, PROUDLEY walks around the artwork. The buzzing continues. FITZPATRICK, working at a computer at a nearby desk, calls out to PROUDLEY."
FITZPATRICK,Hey? You input that new guy's number we met from last week? His cell phone chirps as it receives a message. His eyes light up.
FITZPATRICK,The waitress from the bar? She's got a friend. FITZPATRICK walks over to where PROUDLEY parked the trolley. He notices the billboard is blank.
FITZPATRICK,"What are you doing? Why'd you turn it around, man? Those slats will mess up the paint. As he approaches the trolley, he sees PROUDLEY's legs and feet sticking out from beside it. He walks around to berate his partner."
FITZPATRICK,"Dude, what are you doing? But as he rounds the trolley, FITZPATRICK finds his partner motionless, sat up on the floor with a black trash bag tied over his head. Suddenly the billboard crashes out of the way to reveal the BAND-AID NOSE MAN, who quickly overpowers the shocked FITZPATRICK and tears his head and arm cleanly from his torso. Later. The BAND-AID NOSE MAN pulls the two lifeless bodies across the concrete floor to the open warehouse door, where the waiting refuse truck stands. The camera pans back to the blank billboard, spattered in blood, now tagged with the name ""TRASHMAN""."
DR COLQUITT,"We have to extubate her. It's not necessarily termination, but we not only have to honor the law, Dana, we also have to respect your mother's wishes. SCULLY's phone stars to vibrate. She picks it up. Caller ID states ""William"", then ""Mulder"". She answers."
SCULLY,"Yeah. We hear MULDER's voice on the phone and also in person, some distance away. The camera pans and we see him standing behind the closed ward doors, looking towards SCULLY. SCULLY notices him. She looks very relieved to see him."
MULDER,I'm here.
LANDRY,"All right! Time to go to your new home. Everyone on the bus. NANCY HUFF approaches, holding a crisp, white document in her hand."
HUFF,Excuse me.
LANDRY,Oh.
HUFF,"This is an injunction against this operation, Landry. If any of these buses show up at Franklin Hospital, they'll be turned away by Bucks County sheriffs. HUFF walks off. As the camera pans we see that a new mural of the BAND-AID NOSE MAN has been painted on a nearby red-brick building."
MULDER,"There was some artwork displayed outside Cutler's office after the murder. It was of a figure the people on the street believes defends them. The street artist that made the artwork goes by the name ""Trashman"". No-one knows his real name. Stays anonymous. No one's ever seen him. I suspect the subject may be a mission-oriented killer who believes he's helping the homeless by eliminating those involved with the relocation. And I would stay, but I suspect the subject will kill again. SCULLY nods."
SCULLY,"She asked for Charlie, before she fell into the coma."
MULDER,Your brother?
SCULLY,Yeah. Just him. Not Bill or me or... I don't even know where he is. He hasn't bothered with her or with us for years. Why would she do that? MULDER gently shakes his head.
SCULLY,"And why would she change her living will without talking to me? MULDER leans back, breathing deeply. SCULLY now looks more intently at the necklace."
SCULLY,"And what's this? Oh. I've never seen her wear it. The-the-the date has no significance. It's not any of our birthdays. It's not dad's death or Melissa's. I mean, what is it about that quarter that she would frame it to put it around her neck? Back at MARGARET SCULLY's bedside, DR COLQUITT, NURSE TAILLIE and another nurse are in discussion. A male RESIDENT joins them."
DR COLQUITT,Are you ready to extubate?
NURSE,"Yes, Doctor."
DR COLQUITT,You have a stent on hand?
NURSE,Removing the tube.
DR COLQUITT,On her next exhale.
RESIDENT,Ready? MULDER holds SCULLY close as they watch the medical staff extubate MARGARET SCULLY. SCULLY is distraught.
SCULLY,"I don't care about the big questions right now, Mulder. I just want one more chance to ask my mum a few little ones."
TOM,"Hey, honey, letting you know I checked in at the hotel. I'll call you on the way to the meeting. Kids are good. They're staying at Ed and Melinda's. Love you. Outside, bright headlights suddenly burst into life as a refuse truck appears ominously, cresting a small rise at the far end of her street. Back inside the kitchen, HUFF throws her empty yogurt pot and spoon straight into her trash compactor. She flicks a switch and it rattles into life. Outside, the refuse truck slows down to a stop outside her house. HUFF starts to make a coffee using a Nespresso-type pod machine. She puts a paper cup under the dispenser. Low rumbling. Her phone starts to vibrate across the counter. She walks over to check it - assuming she has a new message - but the phone shows no new activity. She puts it down, annoyed. ""Downtown"" starts to play again, as HUFF takes a large packet of unused coffee pods and throws them straight in the trash. We notice a soft drinks can much like the one we saw on the street earlier. Outside on the street, the refuse truck drives off, leaving the BAND-AID NOSE MAN standing purposefully in the road. When you're alone and life is making you lonely You can always go downtown When you've got worries, all the noise and the hurry Seems to help, I know downtown Inside, HUFF starts to walk around the house making sure all doors and windows are locked. Outside in the street, the BAND-AID NOSE MAN starts to approach the house. Just listen to the music of the traffic in the city Linger on the sidewalk where the neon signs are pretty How can you lose? The lights are much brighter there You can forget all your troubles, forget all your cares As a storm rages outside, HUFF is shocked to notice spots of green sludge and maggots on her polished wooden stairs. As flashes of lightning fill the darkened house, we see BAND-AID NOSE MAN standing at the top of the stairs. So go downtown Things will be great when you're downtown No finer place for sure, downtown You're gonna be alright now, downtown BAND-AID NOSE MAN starts to descend the stairs towards HUFF, who turns and runs. He catches her, but she fights back and hits him in the face, momentarily startling him and sending gobs of green puss flying. She runs through the house towards some French doors leading outside. Downtown Downtown She gets to the doors but BAND-AID NOSE MAN appears in the window and it's too late for HUFF and her wasteful ways. And you may find somebody kind to help and understand you Someone who is just like you and needs a gentle hand to Guide them along Afterwards. BAND-AID NOSE MAN stuffs HUFF's dismembered body into the kitchen trash compactor, before flicking on the switch. So maybe I'll see you there We can forget all our troubles, forget all our cares Later. Outside. His rubbish cleaned up, he throws the sack of trash into the back of the waiting refuse truck before climbing in after it. The truck's compactor lowers and closes and the truck heads off into the rainy night. So go downtown Things will be great when you're downtown Everything is waiting for you, downtown Downtown Downtown Downtown Downtown"
SCULLY,"Back in the day, did... we ever come across the ability to just... wish someone back to life?"
MULDER,"I invented it. When you were in the hospital, like this."
SCULLY,"You're a dark wizard, Mulder. MULDER shrugs his shoulders and laughs."
MULDER,What else is new? SCULLY's cell phone starts to vibrate on the bedside table. She answers.
SCULLY,"Hello? Charlie. Did Bill call you? Yeah. Um... Mum asked for you. Charlie, can you just say something to her, please? Just anything. I don't know. Just... Do what I can't do. Bring her back to us. Okay. I'll put it on speakerphone. SCULLY holds the phone near to her mother's ear."
SCULLY,I've got Charlie here. He's on the phone. I know you can hear him.
CHARLIE,"Mom? It's me. It's Charlie. I heard you were asking for me, so... here I am, for once. What do you want to know? What's the big mystery?"
SCULLY,Anything? Any reaction?
MULDER,"Well, her pulse rate quickened, but I didn't see her move. They both look at MARGARET. Her eyelids start to flutter, before her eyes open slowly. She looks around with her eyes, her head remaining still."
SCULLY,Mom? She just opened her eyes. MULDER leans in.
MULDER,Do you know where you are? Do you know your name? MARGARET turns her head slightly towards MULDER. MULDER holds her outstretched hand in his. She smiles up at him.
MARGARET SCULLY,"My son... is named William, too. MULDER shares a look with SCULLY. Suddenly MARGARET's gaze fixes, and her head turns as she exhales slowly."
SCULLY,"Mom? Mom? Mom. Mom, it's Dana. The heart monitor flatlines. SCULLY holds her mother's face in her hands, willing her to come back."
SCULLY,"Mom, I'm here. I'm here. Come back to us. Mom? Mom? Her brother CHARLIE is still on the phone, unaware of the sudden change for the worse."
CHARLIE,Dana? Dana?
SCULLY,Mom.
CHARLIE,"What's going on? Tearing up, SCULLY leans forward, kissing her mother's forehead as she holds her mother's face in her hands. MULDER looks on. Fade to black."
SCULLY,No! You get that out of here! Get that out of here! MULDER gently puts his arm around SCULLY's shoulders and leads her away from her mother's bedside.
MULDER,"Scully! Scully! No. Margaret's an organ donor. They need her right away. Let her go. SCULLY cries into MULDER's chest, clutching her mother's necklace. He holds her close, his chin on her head."
SCULLY,"Her last words to us... were about our child. Her grandchild. That we gave away. Why did she say that? Why did she have to say that? In the background, the efficient porters are now leaving the ward, pushing the noisy gurney with MARGARET SCULLY's body. SCULLY watches as her mother leaves the ward for the last time. Drying her eyes with her hands and looking for an immediate distraction, SCULLY turns to MULDER."
SCULLY,"Mulder, let's drive to Philadelphia. I need to work."
MULDER,"No. No, no, no."
