speaker,line
SCULLY,Yes. Right now.
MULDER,"No, I get it, Scully, I do. But not right now."
SCULLY,"Mulder, right now. I need to work right now. SCULLY won't take no for an answer. She picks up her jacket and bag from the bedside and walks off towards the exit. MULDER stands there, concerned for her."
BUDD,"I broke down the paint samples you chipped away from the Trashman's signature and analyzed it with vibrational spectography. It defines binders, pigments and additives that are used in spray paint. The binder present in this breakdown was patented by a brand called Cannonz and used only in their high-end spray paints. Whilst BUDD was talking SCULLY has been researching the brand up on her phone."
SCULLY,"Product locator indicates there's only one store in Central Philadelphia that carries it. MULDER gives her a ""Let's Go"" gesture through the window."
SCULLY,Damn! She fires up the SUV and heads after MULDER in pursuit of the suspect.
MULDER,"Federal agents! The man opens the door and enters into the unlit warehouse. MULDER and SCULLY follow. The man suddenly turns and draws a gun, but SCULLY, almost on autopilot, gets him into an armlock, down onto the ground and disarms him in a single, fluid motion. She holds the secured weapon out for MULDER to take as he starts to interrogate the man."
MULDER,We're looking for the Trashman. Moments later. They are descending stairs into darkness.
MAN,"I'm just letting you know, guys, from here on down, there's no light. Power's out. The man suddenly gives them the slip and races back up the stairs into the light."
MULDER,What? I wasn't gonna shoot the kid. And I don't do stairs anymore.
SCULLY,"Mulder, back in the day, I used to do stairs and in three-inch heels."
MULDER,"""Back in the day."" Scully, back in the day is now. SCULLY turns her torch on and leads the way. MULDER, smiling, follows."
SCULLY,"What the hell? They explore further, with both guns and torches drawn. They come to a closed metal door. Light emanates from the bottom of the doorway. MULDER bangs on the door."
MULDER,"Federal agents! Open up! If you're in danger, we're here to help. A male voice calls out from inside."
VOICE,"I am in danger! But go away. MULDER kicks open the door. They enter, guns drawn. They scan the room. We see a life-size clay sculpture of the BAND-AID NOSE MAN, its torso shrouded in black plastic and a clean band-aid stuck over its nostrils."
VOICE,"Put the guns down! They don't work on them! Put them away! They don't work! I tried. I've tried to shoot them. As they move deeper into the room they come across a man, cowering at the back of the dark room behind a shopping cart full of spray paint cans. They train their torches and guns on him."
MULDER,You the Trashman?
TRASHMAN,"Turn down the light, man. Turn down the light. If they don't see me and I don't see them, they can't hurt me. They turn their torches off. Later. The TRASHMAN is sitting at his workbench, strewn with spray cans and lit with a few candles."
TRASHMAN,"The people on the streets - the homeless, street people - they ain't got no voice, right? They get treated like trash. I mean, actual trash. It's like this. You throw your grande cup or your pop bottle in the right trash can under the sink - recyclables here, trash there - you tie it in a bag, you take it outside, you put it in the right dumpsters. Pat yourself on the head. You're a good person, yeah? You did the right thing, you fought global warming, you love all the little animals. Well, Friday come, Wednesday maybe, garbageman takes the trash away. It's not your problem anymore. Magic! But it is your problem, because it piles up in the landfill. And the plastics leak toxins into the water and the sky. But if you don't see a problem, there's no problem, right? People treat people like trash."
MULDER,"So, what, you took care of the problem?"
TRASHMAN,I did my part.
MULDER,By killing Joseph Cutler and Nancy Huff and those two art thieves?
TRASHMAN,"Nah, I was just trying to give those people a voice the only way I know how - through art. Not violence. Something I can put around town, so they wouldn't be forgotten. A stencil that looked over the Bad Suit Building Man, looked down on the Lawn Gnome Suburban Lady..."
MULDER,"Well, why'd you put up the art after the fact? The morning of Cutler's murder?"
TRASHMAN,"I didn't. That, that... that wasn't me. I only thought him up. You know? Those people who got killed - that was only him."
MULDER,"Him? Who, who is him?"
TRASHMAN,You saw those things in the hall.
MULDER,Yeah.
TRASHMAN,"I made them. I didn't mean to, but I made 'em. They'll go away, eventually. They're fading. But the Band-Aid Nose Man... he's different. The camera pans ominously to the sculpture of the BAND-AID NOSE MAN."
TRASHMAN,Tibetan Buddhists would call him a Tulpa. A thought form using mind and energy to will a consciousness into existence.
MULDER,"Tulpa is a 1929 Theosophist mistranslation of the Tibetan word ""tulku,"" meaning ""a manifestation body."" There is no idea in Tibetan Buddhism of a thought form or thought as form. And a... and a realized tulku would never harm anyone, let alone kill."
TRASHMAN,"Okay. But I'm telling you. I spend a lot of energy in my art. I, uh, meditated on it. I willed it. Flashback to the TRASHMAN at his desk, sketching."
TRASHMAN,"What I wanted him to look like, what I wanted him to be, and why I wanted him. Flashback to SCULLY giving birth."
TRASHMAN,I didn't bring him here. He came to me. Flashback. A baby cries. It's WILLIAM. We see his bassinet mobile turning by itself.
TRASHMAN,"But in the end, he told me what he wanted to be. All we do is hold the pencil. All we do is hold the clay. I think there must be spirits and souls floating all around us. And if you think real hard, or you want them so bad... they come to you. Flashback to SCULLY and MULDER holding WILLIAM."
MULDER,What are you gonna call him?
SCULLY,William.
TRASHMAN,And then they become alive with a life of their own. Flashback to earlier at the hospital.
MARGARET SCULLY,"My son... is named William, too. Flashback to SCULLY and MULDER."
SCULLY,"Our son, Mulder. I gave him up. Back in the basement, the TRASHMAN is standing next to his BAND-AID NOSE MAN sculpture."
TRASHMAN,"This... this is what came to me in my dreams. From some other place, yeah? But now it's alive and it's out there. Down to the Band-Aid I used to hold the clay in place. Who would copy this? And did you smell it? It smells like nothing on this Earth. It has its own life. Does what it wants. I just wanted to scare 'em, scare anyone that took dignity away from the homeless. That's where the violent idea popped in my head. It was just an emotion that ran through my head. An idea is dangerous, even a small one. But now he uses that violent idea. He thinks that is what he is supposed to do. SCULLY is almost trance-like - holding her mother's necklace in her hands as the TRASHMAN's words focus her mind on WILLIAM and her mother."
SCULLY,"You are responsible. If you made the problem, if it was your idea... then you're responsible. You put it out of sight, so that it wouldn't be your problem. But you're just as bad as the people that you hate."
MULDER,"If what you believe is possible, the last person involved in the relocation would be Landry."
TRASHMAN,He got the injunction lifted. They're moving people out to Franklin Hospital tonight.
LANDRY,"All right, all right. I'm paying a lot of good money for all this. Let's get going. Time to go home. A queue of waiting homeless people slowly start to climb aboard the bus. Cut back to the warehouse, where MULDER, SCULLY and the TRASHMAN finally exit back into daylight and cell phone coverage. They immediately make calls as they climb back through the wire fence."
SCULLY,We're looking for Daryl Landry...
MULDER,"Mr. Landry, this is Agent Mulder. I need you to call me back. It's urgent."
HOMELESS MAN,I want my dog. I said it. I didn't want to be be here if they wouldn't let me have my dog. LANDRY overhears and interjects.
LANDRY,"Sir, go to your room. The dogs have been sent to the shelter. I'm sure you can find it there. The HOMELESS MAN stares as LANDRY leaves and makes his way down a corridor. Another of the relocated homeless tries to get his attention as he approaches her."
HOMELESS WOMAN,"Mr. Landry, sir? But he ignores her, waving her away and carrying on down the corridor. Several steps later he suddenly stops. He coughs as an unpleasant smell overwhelms him. The homeless people milling around in the corridor suddenly disappear into their rooms. The corridor is eerily quiet. A fly buzzes in the air. LANDRY retches again at the smell. He starts to investigate the source of the smell and ventures into a disused part of the building."
LANDRY,"Somebody down there? This area is off limits! Come back here to the rooms. In a room at the end of a long, dark corridor, a light is buzzing on and off. On the floor, LANDRY notices the same spots of green pus that we saw in NANCY HUFF's house. He turns on his cell phone to use as a torch. His other hand covers his nose and mouth to provide some protection from the smell. He starts to look through the windows of closed doors leading off the corridor. Suddenly we see the shadow of a large figure flickering on the dimly lit wall. More flies buzzing. LANDRY turns and the BAND-AID NOSE MAN is suddenly standing behind him in the corridor. LANDRY starts to run towards the doorway at the end of the corridor as the BAND-AID NOSE MAN strides after him. MULDER, SCULLY and the TRASHMAN are now in the hospital and are quickly tracing LANDRY's movements. They follow down the corridor. Meanwhile, LANDRY is still trying to get away from the BAND-AID NOSE MAN. Looking back, he enters a doorway leading into a communal shower room with no obvious exits. The BAND-AID NOSE MAN follows. LANDRY retreats backwards into the communal shower stall, cowering as the BAND-AID NOSE MAN closes in on his next victim. LANDRY screams out. Moments later, MULDER, SCULLY and the TRASHMAN arrive at the shower room. But it's too late for LANDRY. We see a bloodied, haphazard pile of various limbs, head and torso on the shower floor, his still-lit phone illuminating the room. TRASHMAN hangs back. MULDER and SCULLY inch forward."
SCULLY,"There's one way out of this room. He just screamed seconds ago. How did we not see whoever did this to him leave the room? As they look down, they see the bloodied tell-tale band-aid on the floor beside one of LANDRY's shoes."
SCULLY,"I know now why Mom asked for Charlie, even though he was out of her life. She wanted to know before he left that he'd be okay. She gave birth to him. She made him. He's her responsibility. And that's why she said what she said to us. She wanted to make sure that we'd be responsible, to know that William's okay. Even though we can't see him. I know that, as parents, we made a difficult sacrifice, to keep him safe. That it was for his own good to put him up for adoption. But I can't help but think of him, Fox. I can't help it. I believe that you will find all of your answers. You will find the answers to the biggest mysteries, and I will be there when you do. She turns to MULDER, her voice breaking. He turns to her."
SCULLY,"But my mysteries... I'll never have answered. I won't know if he thinks of me, too, or, if he's ever been afraid and wished that I was there. Does he doubt himself because we left him? What questions does he have of me? The same that I have with this quarter? And I want to believe... I need to believe, that we didn't treat him like trash. MULDER puts his arm around her, and she puts her head on his shoulder, sobbing. Fade to black. It's been a while since I last updated - please let me know if you like the new transcript!"
